Date,Description,Short Description
2024-09-05,"According to BlockBeats, data from Coinglass on September 5 indicates that if Bitcoin's price falls below $57,000, the cumulative liquidation intensity of long positions on major centralized exchanges (CEX) will reach $845 million. Conversely, if Bitcoin surpasses $59,000, the cumulative liquidation intensity of short positions on major CEX will amount to $570 million.BlockBeats notes that the liquidation chart does not display the exact number of contracts pending liquidation or the precise value of liquidated contracts. Instead, the bars on the chart represent the relative importance of each liquidation cluster compared to adjacent clusters, indicating intensity.Therefore, the liquidation chart illustrates the extent to which the price of the underlying asset will be affected when it reaches a certain level. Higher 'liquidation bars' suggest a stronger reaction due to liquidity waves when the price hits those levels.","If Bitcoin's price falls below $57,000, the cumulative liquidation intensity of long positions on major centralized exchanges will reach $845 million. If Bitcoin surpasses $59,000 the same amount will amount to $570 million. The liquidation chart shows the relative importance of each liquidation cluster compared to adjacent clusters."
2024-09-05,"According to BlockBeats, on September 5, monitoring by Farside Investors revealed that Fidelity's FBTC experienced a net outflow of $7.6 million yesterday. As of the time of reporting, the total net outflow from disclosed Bitcoin ETFs amounted to $37.2 million yesterday.",The total net outflow from disclosed Bitcoin ETFs amounted to $37.2 million yesterday. Fidelity's FBTC experienced $7.6 million in outflow yesterday. BlockBeats is monitoring Farside Investors' FBTC on September 5th.
2024-09-05,"On Sep 05, 2024, 00:02 AM (UTC). According to Binance Market Data, Bitcoin (BTC) has crossed the 58,000 USDT benchmark and is now trading at 58,018.988281 USDT, with a narrowed 0.86% increase in 24 hours.","Bitcoin has crossed the 58,000 USDT benchmark and is now trading at 58,018.988281 USDT with a narrowed 0.86% increase in 24 hours. Bitcoin is trading on Sep 5, 2024, at 00:02 AM (GMT)."
2024-09-04,"According to BlockBeats, on September 5, data monitored by Farside Investors revealed mixed fund flows for U.S. spot Bitcoin and Ethereum ETFs as of September 4. The report highlighted significant movements in several ETFs, reflecting varying investor sentiment and market dynamics.For spot Bitcoin ETFs, the Grayscale Bitcoin Trust (GBTC) experienced a net outflow of $34.2 million, indicating a substantial withdrawal of funds. In contrast, the ProShares Bitcoin Strategy ETF (BITB) saw a net inflow of $9.5 million, suggesting increased investor interest. The ARK Next Generation Internet ETF (ARKB) reported no changes in fund flows, with neither inflows nor outflows recorded.In the case of spot Ethereum ETFs, the Grayscale Ethereum Trust (ETHE) faced a net outflow of $40.6 million, showing a significant reduction in holdings. Conversely, the ProShares Ether Strategy ETF (ETH) registered a net inflow of $3.1 million, pointing to a modest increase in investments. Both the Grayscale Ethereum Classic Trust (CETH) and the ProShares Ether Strategy ETF (ETHW) reported no fund flow changes, with no inflows or outflows noted.These mixed fund flows in U.S. spot Bitcoin and Ethereum ETFs reflect the ongoing volatility and investor sentiment in the cryptocurrency market. The contrasting movements in different ETFs underscore the diverse strategies and preferences among investors as they navigate the evolving landscape of digital assets.",The data monitored by Farside Investors revealed mixed fund flows for U.S. spot Bitcoin and Ethereum ETFs as of September 4. Bitcoin and Ether Strategy ETFs experienced a net inflow of $9.5 million and a net outflow of $34.2 million. ARK Next Generation Internet ETF (ARKB) reported no changes in fund flows.
2024-09-04,"According to Cointelegraph, Bitcoin mining companies are exploring diversification into data centers to enhance revenue. However, Phil Harvey, CEO of blockchain data center consulting firm Sabre56, argues that this shift to high-performance computing is impractical due to significant cost differences and logistical challenges. Harvey highlighted that operating an AI or high-performance data center is far more expensive than running a crypto mining facility. He noted that a typical commercial mining operation costs between $300,000 and $350,000 per megawatt, whereas AI data centers require between $3 million and $5 million per megawatt—a 10-15x increase. Additionally, a mining operation with a gigawatt of available power can only convert approximately 200 megawatts for high-performance computing needs. The CEO emphasized that only about 20% of a miner's portfolio could potentially support the necessary attributes like power, data, and land for AI. He also pointed out the significant physical space requirements, with crypto mining needing 1,000 square feet per megawatt compared to 5,000 square feet per megawatt for AI or HPC data centers. Furthermore, converting crypto mining facilities to AI and high-performance data centers involves substantial upfront costs, with over 90% of existing infrastructure needing replacement. Bitcoin miners are seeking alternative revenue streams due to decreased block subsidies and reduced revenues, which hit an 11-month low in August. The idea of shifting to AI data centers and high-performance computing has been proposed, raising concerns about energy resource allocation between the emerging AI industry and crypto mining. A report by VanEck suggested that Bitcoin mining companies could potentially earn $13.9 billion in annual revenues if they allocate 20% of their output to AI data processing and high-performance computing. However, the practical challenges and significant costs involved in such a transition make it a complex and potentially unfeasible solution for many mining companies.",Bitcoin mining companies are considering shifting to AI data centers and high-performance computing to boost their revenue. Phil Harvey argues that the shift to AI is too expensive and difficult due to significant cost differences and logistical challenges. Bitcoin miners are seeking alternative revenue streams due to decreased block subsidies and reduced revenues.
2024-09-04,"According to CoinDesk, as the cryptocurrency market reaches new heights, led by assets like Bitcoin, Ethereum, and Solana, investors are increasingly focused on optimizing their portfolios. While the growth potential of these major cryptocurrencies is evident, the challenge in this maturing market is the hunt for yield, especially for Bitcoin holders and those seeking effective collateral options.Bitcoin’s primary appeal has always been its potential for significant capital appreciation. However, unlike Ethereum and Solana, which offer staking rewards, Bitcoin lacks a straightforward method for generating yield. Traditionally, investors have resorted to lending their Bitcoin to earn interest. This approach carried significant risks, particularly due to rehypothecation, where assets were used as collateral for further lending. This practice led to a credit bubble that burst in 2022, resulting in widespread insolvencies and a loss of trust in many facets of the market.The fallout from the 2022 crisis has pushed the industry to innovate. One of the most promising developments has been the rise of tokenized money market funds. These funds offer a way to generate yield with the speed and efficiency of crypto combined with the safety of government-backed Treasury bills. Unlike stablecoins, which are also backed by similar assets but often fail to provide yield, tokenized money market funds offer an efficient option for collateral and margining purposes, aligning with the needs of investors seeking both yield and safety.In addition to these funds, some of the top digital asset managers have devised strategies to generate yield on long Bitcoin positions without the need for lending. By entering into carefully selected derivatives structures, investors can earn options-yield while retaining segregated custody of their assets and without sacrificing upside. This approach addresses the dual challenge of income generation and asset security, offering a viable alternative for long-term holders who have traditionally relied on buy-and-hold strategies.The hunt for yield in crypto is evolving. As the market matures, integrating yield-generating mechanisms like tokenized money market funds and secure options vaults will likely become essential for professional portfolios. These innovations represent a new frontier in crypto investment, where the focus is not just on capital appreciation but also on generating steady, reliable income. For investors, this marks a significant shift—one that could redefine the role of crypto in diversified portfolios.","As the cryptocurrency market matures, investors are looking for yield-generating methods to improve their portfolios. One of the most promising developments has been the rise of tokenized money market funds and secure options vaults. They offer a way to generate yield with the speed and efficiency of crypto and the safety of government-backed Treasury bills."
2024-09-04,"According to Odaily, the U.S. Securities and Exchange Commission (SEC) announced on Tuesday that it will extend the final decision deadline for the 7RCC Spot Bitcoin ETF and the Carbon Credit Futures ETF to November 21. The SEC stated that it is necessary to designate a longer period to issue an order approving or disapproving the proposed rule changes to allow sufficient time to consider the proposed rule changes and the comments related to them.",The SEC will extend the final decision deadline for the 7RCC Spot Bitcoin ETF and Carbon Credit Futures ETF to November 21. The SEC states that it is necessary to designate a longer period to issue an order approving or disapproving the proposed rule changes to allow enough time to consider the proposed changes and the comments related to them.
2024-09-04,"On Sep 04, 2024, at 3:53 PM (UTC), according to Binance Market Data, Bitcoin (BTC) crossed the 58,000 USDT benchmark and is now trading at 58,037.171875 USDT, with a narrowed 0.63% increase in 24 hours.","Bitcoin has crossed the 58,000 USDT benchmark and is now trading at 58,037.171875 USDT, with a narrowed 0.63% increase in 24 hours on Sep 04, 2024, at 3:53 PM (UTC), according to Binance Market Data."
2024-09-04,"On Sep 04, 2024, 2:44 PM (UTC), according to Binance Market Data, Bitcoin (BTC) has crossed the 57,000 USDT benchmark and is now trading at 57,022.011719 USDT, with a narrowed 1.60% decrease in 24 hours.","Bitcoin has crossed the 57,000 USDT benchmark and is now trading at 57,022.011719 USDT, with a narrowed 1.60% decrease in 24 hours. Binance Market Data shows Bitcoin is trading on Sep 04, 2024 at 2:44 PM (UTC)."
2024-09-04,"According to Cointelegraph: Bitcoin is facing a significant delay in reaching new all-time highs post-halving, a trend that has disappointed bulls and concerned traders. According to popular trader Peter Brandt, Bitcoin’s slow progress compared to historical cycles has set a record, leaving many investors frustrated.In his recent analysis on X, Brandt noted that Bitcoin’s previous peak from 2021, at $73,800, remains unchallenged. Despite the latest block subsidy halving event in April 2024, the asset has yet to approach a new all-time high, marking the longest-ever delay for such a milestone after a halving.Source: Peter BrandtRecord Delay to New Highs Post-HalvingBrandt highlighted that while Bitcoin has experienced cyclical highs and lows before, this time around, it has failed to break out from its previous record on an inflation-adjusted basis. He measures these cycles differently than many, starting from the previous bear market low in November 2022 and tracking the high that followed before the halving.The lack of energy in Bitcoin’s price action has led to significant resistance at the 2021 peak of $69,000, posing a formidable challenge to recovery. Despite this, Brandt emphasized that Bitcoin has not been in a prolonged downtrend but is struggling to gain the momentum needed for price discovery.Frustrating Price Action Despite Fed Rate CutsAs the U.S. prepares for potential interest rate cuts in September, analysts suggest that Bitcoin’s price movements will likely remain sluggish. On-chain analytics platform CryptoQuant noted that while some short-term gains may occur due to positive sentiment surrounding the expected rate cuts, substantial recovery might not happen until 2025.One forecast even suggested that the anticipated rate cut by the Federal Reserve could lead to a 20% decline in Bitcoin’s value, further extending the frustration for investors hoping for a breakout.With Bitcoin still trading 10% below its all-time high, investors may need patience as the market continues to struggle post-halving. Analysts and traders alike are keeping a close eye on macroeconomic factors and waiting for signs of recovery, potentially in 2025.","Bitcoin is struggling to reach new all-time highs after the block subsidy halving event in April 2024. Bitcoin's previous peak from 2021 was at $73,800. Bitcoin is still trading 10% below its previous high of $69,000. Analysts and traders are keeping an eye on macroeconomic factors and waiting for signs of recovery in 2025."
2024-09-04,"According to BlockBeats, on September 4, Arkham monitoring revealed that Grayscale transferred 700 BTC to an unmarked address starting with bc1qh approximately 10 minutes ago.",Grayscale transferred 700 BTC to an address starting with bc1qh 10 minutes ago. BlockBeats monitored the transfer on September 4th and found out that Grayscale had transferred the money to an unmarked address starting bc1Qh on September 5th.
2024-09-04,"According to Foresight News, Bitcoin mining company Stronghold has released its August Bitcoin mining and operations update. In August 2024, Stronghold mined 63 Bitcoins, generating approximately $0.2 million in energy revenue. This amount is equivalent to an additional 4 Bitcoins based on the average Bitcoin price for the month, resulting in a total output of around 67 Bitcoin equivalents, marking a 2% increase from the previous month. Additionally, the company reported $4 million in revenue for August, which is a 2% decrease compared to the previous month. According to Foresight News, Bitfarms and Stronghold signed a final merger agreement in August, with the merger expected to be completed in the first quarter of next year.","Stronghold has released its August Bitcoin mining and operations update. In August, Stronghold mined 63 Bitcoins and generated $0.2 million in energy revenue. The company reported $4 million in revenue for August. Bitfarms and Stronghold signed a final merger agreement in August. The merger is expected to be completed in the first quarter of next year."
2024-09-04,"According to Odaily, data from Intotheblock reveals that addresses holding between 100 and 1,000 BTC have not been affected by market fluctuations and have been steadily increasing their holdings over the past few months. These addresses now hold 20.3% of the circulating supply of Bitcoin.","The Bitcoin addresses holding between 100 and 1,000 BTC have been steadily increasing their holdings over the past few months. These addresses now hold 20.3% of the circulating supply of Bitcoin. Data from Intotheblock reveals that addresses holding 100-1000 BTC have not been affected by market fluctuations."
2024-09-04,"According to Odaily, Bitcoin mining company MARA Holdings, Inc. released its unaudited BTC production and miner report for August 2024. The data reveals that MARA's hash rate increased to 35.2 EH/s in August, marking an 11% rise from July. However, the company's block production for the month saw a 2% decline compared to July, and BTC production dropped by 3%, resulting in 673 BTC produced in August. As of August 31, 2024, MARA Holdings holds a total of 25,945 unrestricted BTC. Notably, the company did not sell any BTC during August.","Mara Holdings, Inc. released its unaudited BTC production and miner report for August 2024. The data reveals that MARA's hash rate increased to 35.2 EH/s in August, marking an 11% rise from July. However, the company's block production for the month saw a 2% decline compared to July, and BTC production dropped by 3%."
2024-09-04,"According to Odaily, Zurich Cantonal Bank, with a market capitalization of $290 billion, has launched Bitcoin and cryptocurrency products. This move marks a significant step for the Swiss financial institution as it ventures into the digital asset space.",Zurich Cantonal Bank has launched Bitcoin and cryptocurrency products. The bank has a market capitalization of $290 billion. This is a significant step for the Swiss financial institution as it ventures into the digital asset space. The move marks the bank's first venture into digital assets.
2024-09-04,"According to Odaily, Grayscale Research recently stated that a weakening dollar and continued low interest rates could benefit Bitcoin. Similar to physical gold, Bitcoin serves as an alternative currency system competing with the dollar in the international market. The research team also noted that the primary downside risk for cryptocurrency valuations is a further rise in unemployment and a potential recession. Therefore, investors should closely monitor upcoming labor market data, including the next monthly employment report scheduled for release on September 6. Despite the recession risks, Grayscale Research believes that there is little tolerance for a significant economic downturn. Policymakers are likely to intervene at the first signs of trouble by injecting liquidity and promoting consumption. The lack of discipline in monetary and fiscal policies is one reason some investors choose to invest in Bitcoin. Consequently, periods of economic weakness may further highlight Bitcoin's long-term investment value.",Grayscale Research believes that a weakening dollar and low interest rates could benefit Bitcoin. The primary downside risk for Bitcoin valuations is a rise in unemployment and a potential recession. The next monthly employment report is scheduled for release on September 6. Bitcoin is an alternative currency system competing with the dollar in the international market. Some investors choose to invest in Bitcoin.
2024-09-04,"According to CoinDesk, Cantor Fitzgerald CEO Howard Lutnick has stated that traditional financial companies are eager to engage in bitcoin transactions as a new asset class but are hindered by current U.S. regulatory requirements. Lutnick highlighted that the regulatory environment is the primary reason banks do not hold bitcoin, as they would need to set aside an equivalent amount of their own money, effectively putting it 'in jail.' He emphasized that a favorable regulatory environment would lead to a significant increase in traditional financial companies investing in bitcoin.Lutnick made these remarks in a post on X, noting that bitcoin is currently an 'outsider to the TradFi community' and is only beginning to integrate into global finance. He reiterated that if regulatory conditions were more accommodating, traditional financial institutions would fully embrace bitcoin.Cantor Fitzgerald, which announced plans to open a bitcoin financing business in June, owns a substantial amount of bitcoin. The firm plans to launch its bitcoin financing business with $2 billion in lending, providing leverage to BTC holders. Additionally, Cantor Fitzgerald already manages U.S. Treasury trading with stablecoin issuer Tether.",Cantor Fitzgerald CEO Howard Lutnick has said that traditional financial companies are reluctant to engage in bitcoin transactions due to current U.S. regulatory requirements. Cantor Fitzgerald plans to launch its bitcoin financing business with $2 billion in lending and manage Treasury trading with stablecoin issuer Tether.
2024-09-04,"According to CoinDesk, Bitcoin mining profitability has reached a record low, as reported by JPMorgan in a recent research report. The aggregate market capitalization of U.S.-listed Bitcoin miners tracked by the bank fell by 15% last month. The report highlighted that mining difficulty increased by 9% from the previous month.JPMorgan analysts Reginald Smith and Charles Pearce noted that Bitcoin miners earned an average of $43,600 per exahash per second (EH/s) in daily block reward revenue in August, marking the lowest point on record. This is a significant drop from the peak value of $342,000 in November 2021, when Bitcoin's price was $60,000 and the network hash rate was 161 EH/s.The decline in mining stocks was attributed to the falling average price of Bitcoin for the third consecutive month and the rising network hash rate. The total market cap of the 14 U.S.-listed miners tracked by JPMorgan shrank to $20 billion, with only three miners outperforming Bitcoin during this period. The network hash rate, which serves as a proxy for competition and mining difficulty, averaged 631 EH/s in August, up 16 EH/s from the previous month and about 20 EH/s below pre-halving levels.JPMorgan also noted that mining difficulty rose by 9% last month and is now 4% higher than before the halving. There was a brief spike in transaction fees in August, reaching as much as 120% of the block reward, which provided an incremental positive for miners. Additionally, Bitcoin's annualized volatility increased to 62% in August, up from 45% in July.","Bitcoin mining profitability has reached a record low. The aggregate market capitalization of U.S.-listed Bitcoin miners tracked by JPMorgan fell by 15% last month. The average daily block reward revenue in August was $43,600 per exahash per second (EH/s). The network hash rate averaged 631 EH/s in August. Bitcoin's annualized volatility increased to 62"
2024-09-04,"According to Odaily, as of September 1, 2024, BlackRock's IBIT has emerged as the world's largest institutional Bitcoin holder, possessing 357,509 Bitcoins. MicroStrategy has surpassed Grayscale's GBTC, holding 226,500 Bitcoins compared to GBTC's 225,671, securing the second position. Fidelity's FBTC ETF ranks fourth with 178,349 Bitcoins, while stablecoin giant Tether holds 75,354 Bitcoins, placing it fifth. Other notable institutional holders include ARK Invest/21 Shares' ARKB with 37,147 Bitcoins and Bitcoin mining company Marathon Digital with 25,000 Bitcoins. It is noteworthy that MicroStrategy announced earlier this year its transformation into a 'Bitcoin development company,' making it the largest known institutional holder before the emergence of Bitcoin ETFs.","BlackRock's IBIT is the world's largest institutional Bitcoin holder with 357,509 Bitcoins. MicroStrategy has surpassed Grayscale's GBTC with 226,500 Bitcoins compared to GBTC's 225,671. Fidelity's FBTC ETF ranks fourth with 178,349 Bitcoins, Tether's 75,354 Bitcoins, ARK Invest/21 Shares' ARKB with 37"
2024-09-04,"According to BlockBeats, on September 4, monitoring by Trader T revealed that institutional investment in Bitcoin and its derivatives was not active in August. The MSTR-BTC sentiment data showed an upward sentiment of +1.1x and a downward sentiment of -1.3x. MSTR-BTC sentiment refers to the market's perception and expectations regarding the correlation between MicroStrategy (MSTR) stock and Bitcoin (BTC). This sentiment indicates a certain degree of market inclination towards the relationship between MicroStrategy and Bitcoin.",The MSTR-BTC sentiment data showed an upward sentiment of +1.1x and a downward sentiment of -1.3x in August. The data shows the market's perception and expectations regarding the correlation between MicroStrategy stock and Bitcoin (BTC).
2024-09-04,"On Sep 04, 2024, 01:05 AM (UTC). According to Binance Market Data, Bitcoin (BTC) has dropped below 56,000 USDT and is now trading at 55,756.769531 USDT, with a narrowed 6.01% decrease in 24 hours.","Bitcoin has dropped below 56,000 USDT and is now trading at 55,756.769531 USDT with a narrowed 6.01% decrease in 24 hours. Bitcoin is trading on Binance Market Data at 01:05 AM (GMT) on Sep 04, 2024."
2024-09-04,"On Sep 04, 2024, 01:00 AM (UTC). According to Binance Market Data, Bitcoin (BTC) has dropped below 57,000 USDT and is now trading at 56,964.511719 USDT, with a narrowed 3.87% decrease in 24 hours.","Bitcoin has dropped below 57,000 USDT and is now trading at 56,964.511719 USDT, with a narrowed 3.87% decrease in 24 hours. Bitcoin is trading on Sep 04, 2024, 01:00 AM (UTC)."
2024-09-03,"On Sep 03, 2024, 10:14 PM (UTC), according to Binance Market Data, Bitcoin (BTC) has crossed the 58,000 USDT benchmark and is now trading at 58,009.988281 USDT, with a narrowed 1.81% decrease in 24 hours.","Bitcoin has crossed the 58,000 USDT benchmark and is now trading at 58,009.988281 USDT, with a narrowed 1.81% decrease in 24 hours. Binance Market Data shows Bitcoin is trading on Sep 03, 2024, 10:14 PM (UTC)."
