Date,Description,Short Description
2024-08-31,"According to Cointelegraph, Bitcoin's next move must print a bullish 'higher high' on the price chart to keep its uptrend intact after recently dropping below $58,000, as per crypto analyst Matthew Hyland. Hyland emphasized the importance of Bitcoin bouncing back and making a higher high to confirm the ongoing uptrend since August. He noted that Bitcoin must stay above the $57.7K level and, if it breaks down, it must hold the $56K level to avoid a lower low. However, some traders believe Bitcoin needs to drop further before resuming its uptrend. Markus Thielen, head of Research at 10x Research, suggested waiting for Bitcoin's price to fall into the low $40,000s for an ideal entry into the bull market. At the time of publication, Bitcoin is trading at $59,218, recovering from a dip to $57,925 in the past 24 hours, according to CoinMarketCap data. Bitcoin is down 7.69% over the past seven days. Hyland reiterated that since August, Bitcoin has seen higher lows and higher highs, despite major pullbacks at the beginning of both July and August. He believes Bitcoin will experience some volatility ahead of the United States presidential election on November 4 and expects mostly sideways action in September, historically the worst-performing month for Bitcoin. Cointelegraph noted that Bitcoin's price action in September might not follow previous years' trends, as Bitcoin miner selling pressure has stabilized and the stablecoin supply ratio shows bullish signs. Meanwhile, pseudonymous crypto trader Jelle shared with their 91,000 X followers that a multi-year view of the Bitcoin price chart suggests Bitcoin could still reach the six-figure mark in the near term. Jelle illustrated a pattern between May 2020 and August 2024, indicating a six-figure target. Jelle expressed confidence that Bitcoin would be closer to this target by the end of the year.","Bitcoin's next move must print a bullish 'higher high' on the price chart to keep its uptrend intact. Bitcoin is trading at $59,218 at the time of publication, recovering from a dip to $57,925 in the past 24 hours. Mark Thielen suggests waiting for Bitcoin's price to fall into the low $40,000s for an ideal entry into"
2024-08-31,"According to Odaily, Starbucks stores in El Salvador have started accepting Bitcoin as a payment method. This development was highlighted in a video posted by Bitcoin Magazine on the X platform. The move aligns with El Salvador's ongoing efforts to integrate Bitcoin into its economy, following the country's adoption of the cryptocurrency as legal tender.",The Starbucks stores in El Salvador have started accepting Bitcoin as a payment method. El Salvador's ongoing efforts to integrate Bitcoin into its economy are being led by the country's adoption of the cryptocurrency as a legal tender. The development was highlighted in Bitcoin Magazine on the X platform.
2024-08-30,"According to Cointelegraph, a new peer-reviewed scientific paper titled 'An Integrated Landfill Gas-to-Energy and Bitcoin Mining Framework,' published in the Aug. 29 edition of the Journal of Cleaner Production, has demonstrated how Bitcoin (BTC) mining could play a significant role in reducing methane emissions. The research highlights how Bitcoin miners can leverage 'Landfill Gas to Energy' (LFGTE) systems to capture and convert methane gas from landfills into usable energy, thereby sequestering the greenhouse gas and mitigating its harmful effects on the atmosphere. The paper argues that Bitcoin mining offers the proper incentive structure for such capital-intensive, long-term projects, which other private enterprises often lack due to the absence of sustainable revenue generation and cost recovery strategies. The researchers stated, 'Bitcoin’s economic incentives, available globally for miners in any location, may offer an innovative solution for encouraging methane mitigation without the need for government incentives—presenting a scalable and novel solution for rapid deployment.' They also noted that this incentive structure could be applied to other underutilized energy sources, such as orphaned oil and gas wells, wastewater treatment plants, farms, and agricultural processing operations. In 2023, Marathon Digital, formerly known as MARA, partnered with Nodal Power to mine Bitcoin using methane gas in Utah. At the time of the 280-kilowatt initiative's announcement, MARA Chairman and CEO Fred Thiel stated, 'At Marathon, we are constantly seeking innovative ways to diversify our operations, lower our energy costs, and leverage the unique aspects of Bitcoin mining to better the environments in which we operate.' In May 2024, the company furthered this mission by signing a deal with the Kenyan government to develop renewable energy infrastructure within the country. The findings of the recent paper are corroborated by other research. In 2023, a study published by the Institute of Risk Management found that Bitcoin mining operations could reduce global emissions by around 8% by 2030.","Bitcoin mining can reduce methane emissions by 8% by 2030. In 2023, Marathon Digital, formerly known as MARA, partnered with Nodal Power to mine Bitcoin using methane gas in Utah. In May 2024, the company signed a deal with the Kenyan government to develop renewable energy infrastructure within the country."
2024-08-30,"According to Cointelegraph, long-term Bitcoin (BTC) holders often encounter challenges when trying to use their wealth to secure financing. Adam Reeds, CEO and co-founder of Ledn, a company specializing in Bitcoin lending services, discussed how Bitcoin collateralized loans can enhance the velocity of money and capital. Reeds highlighted that many early Bitcoin adopters are reluctant to sell their BTC to access liquidity and often find it difficult to secure loans from traditional financial institutions, which may not recognize Bitcoin holdings as collateral. This situation keeps the collateral locked up and unproductive in the broader economy. The solution, according to Reeds, is to utilize Bitcoin collateral by borrowing against it. This allows Bitcoin holders to access fiat-denominated liquidity for various purposes, such as financing a business, consumer spending, real estate, or even acquiring more BTC. Bitcoin loans are highly efficient, enabling borrowers to secure financing within days, unlike the weeks or months typically required by traditional institutions. Reeds emphasized the soundness of Bitcoin as collateral, agreeing with Michael Saylor's view that Bitcoin is a thermodynamically sound asset class, free from the physical depreciation that affects many other asset types. He stated that lending against Bitcoin is a lower-risk activity compared to lending against real estate or equities, as Bitcoin lacks GAAP risk. Reeds also noted that Bitcoin is not subject to counterparty risks such as false media reports, fake whistleblower accounts, and bad press, which can negatively impact the price of a business or equity. Reeds also addressed the lack of banking infrastructure and adequate financial services in some parts of the world. He suggested that Bitcoin-collateralized loans could provide financial opportunities for the unbanked and those living in high-inflation environments. Examples include Argentina, with a 276% annual inflation rate, and Nigeria, which has an unbanked population of 38 million residents.","Adam Reeds is the CEO and co-founder of Ledn, a company specializing in Bitcoin lending services. Bitcoin is a thermodynamically sound asset class, free from the physical depreciation that affects many other asset types. Bitcoin-collateralized loans can provide financial opportunities for the unbanked and those living in high inflation environments."
2024-08-30,"According to Odaily, Bitcoin Magazine has revealed that CNBC reports nearly half of all corporate funds raised for the US presidential election come from Bitcoin and cryptocurrencies. These contributions have surpassed those from major oil companies and banks. So far, the flow of cryptocurrency funds appears to be a significant indicator of electoral success.",Nearly half of all corporate funds raised for the US presidential election come from Bitcoin and cryptocurrencies. The flow of cryptocurrency funds appears to be a significant indicator of electoral success. Bitcoin Magazine has revealed that CNBC reports that Bitcoin is the most popular currency in the US. Bitcoin magazine has also revealed that Bitcoin has surpassed the contributions from major oil companies and banks.
2024-08-30,"According to Odaily, Arkham announced on the X platform that Tesla has not sold its Bitcoin holdings. The company still possesses the 11,500 BTC it acquired in late January 2021 at approximately $32,000 per Bitcoin. Tesla has held these assets for over three years, and their value has now increased by $300 million.","Tesla has not sold its Bitcoin holdings. The company still has 11,500 BTC it acquired in late January 2021 at approximately $32,000 per Bitcoin. Tesla has held these assets for over three years and their value has now increased by $300 million. Arkham announced on the X platform that Tesla has still possesses the Bitcoin."
2024-08-30,"According to BlockBeats, cryptocurrency analyst Miles Deutscher has observed a recent trend in Bitcoin trading characterized by 'Asian buying and U.S. selling.' Over the past two weeks, Bitcoin's cumulative return during Asian trading hours has exceeded 5%, while U.S. trading hours have shown negative returns.Next week's key data point will be the non-farm payroll report for August, scheduled for release on Friday, September 6. The July employment report was weak, which could prompt the Federal Reserve to commit to a rate cut in September. Currently, the market expects a 25 basis point rate cut in mid-September. However, suppose the employment data remains weak for a second consecutive month. In that case, investors might quickly anticipate a 50 basis point rate cut, providing a strong positive stimulus for risk markets, including Bitcoin.Conversely, if the September employment report is strong, expectations for accommodative monetary policy may diminish. Regardless of the outcome, volatility is likely to occur, with an approximately 50% probability of upward movement.","Bitcoin's cumulative return during Asian trading hours has exceeded 5%, while U.S. trading hours have shown negative returns. Next week's key data point will be the non-farm payroll report for August, scheduled for release on Friday, September 6th. The July employment report was weak, which could prompt the Federal Reserve to commit to a rate cut in September. The market expects"
2024-08-30,"On Aug 30, 2024, 15:38 PM (UTC). According to Binance Market Data, Bitcoin (BTC) has dropped below 58,000 USDT and is now trading at 57,979.691406 USDT, with a narrowed 5.03% decrease in 24 hours.","Bitcoin has dropped below 58,000 USDT and is now trading at 57,979.691406 USDT, with a 5.03% decrease in 24 hours. Bitcoin is trading on Binance Market Data at 15:38 PM (UTC)."
2024-08-30,"According to BlockBeats, on August 30, CryptoQuant's Head of Research, Julio Moreno, stated on social media that Bitcoin market cycle indicators are once again in a bearish phase. From a price perspective, if Bitcoin's price falls below $56,000, the risk of a more significant pullback will increase.","The Bitcoin market cycle indicators are in a bearish phase. If Bitcoin's price falls below $56,000, the risk of a more significant pullback will increase. On August 30, CryptoQuant's Head of Research, Julio Moreno, said on social media that Bitcoin's prices are bearish."
2024-08-30,"According to Odaily, a dormant Bitcoin address holding 23.18 BTC has been activated after 13.1 years. The value of these Bitcoins is approximately $1,359,147. This information was monitored by Whale Alert.","A dormant Bitcoin address holding 23.18 BTC has been activated after 13.1 years. The value of these Bitcoins is approximately $1,359,147. This information was monitored by Whale Alert on Odaily's request. The address's value has been monitored."
2024-08-30,"On Aug 30, 2024, 14:44 PM(UTC). According to Binance Market Data, Bitcoin has dropped below 59,000 USDT and is now trading at 58,942.941406 USDT, with a narrowed 3.22% decrease in 24 hours.","Bitcoin has dropped below 59,000 USDT and is now trading at 58,942.941406 USDT with a 3.22% decrease in 24 hours. Bitcoin is trading on Binance Market Data at 14:44 PM(UTC) on August 30, 2024."
2024-08-30,"According to PANews, Whale Alert has reported a significant Bitcoin transaction. On August 30 at 21:46 UTC+8, a total of 1,783 BTC, valued at approximately $106,003,406, was transferred from an unknown wallet to another unknown wallet.","Whale Alert has reported a significant Bitcoin transaction on August 30 at 21:46 UTC+8. 1,783 BTC was transferred from an unknown wallet to another unknown wallet worth $106,003,406. The transaction took place in Bitcoin worth $1,783."
2024-08-30,"According to Odaily, Bitcoin Magazine recently reported on the X platform that more than 110 companies are currently involved in Bitcoin-related activities across Africa.",There are more than 110 companies involved in Bitcoin-related activities across Africa. Bitcoin Magazine reports on X platform that more than 100 companies are currently involved in such activities in Africa. The X platform is a platform on the X platform and is open to all users.
2024-08-30,"According to Odaily, data from Crypto Quant reveals that Bitcoin exchange reserves have reached their lowest point this year, dropping to approximately 2.69 million BTC.","Bitcoin exchange reserves have reached their lowest point this year at 2.69 million BTC, according to data from Crypto Quant. The reserves have dropped to approximately 2.9 million BTC this year from 2.7 million BTC in the last 12 months. The reserve level is the lowest this year."
2024-08-30,"According to CoinDesk: Bitcoin (BTC) attempted to regain momentum once again during Thursday's U.S. trading session, with the price falling below $59,000 after briefly climbing above $61,000. Despite the dip, BTC managed to hold onto a 0.6% gain over the past 24 hours, in line with the broader market, as reflected by the CoinDesk 20 Index. However, Ether (ETH) faced slight pressure, down 0.5%, just above the $2,500 mark.The day’s most significant losses were seen in artificial intelligence-focused cryptocurrencies, which tumbled following a sharp decline in Nvidia's (NVDA) stock. Nvidia, a leading chipmaker, saw its shares drop by 6.4% after releasing its quarterly earnings report on Wednesday evening. This decline weighed heavily on AI-related tokens, with Render (RNDR), Artificial Superintelligence Alliance (FET), and Bittensor (TAO) all falling between 7% and 10%. U.S. equities also struggled, with early gains evaporating by late afternoon. The tech-heavy Nasdaq led the retreat, dropping 0.3% after being up more than 1.5% earlier in the day.Crypto bulls needed to push Bitcoin’s price past $61,000—above critical short-term moving averages on the 4-hour chart—to have a meaningful chance of rallying toward the upper end of its recent range. The current price action suggests that the crypto market is likely headed for more consolidation as the recovery from early August’s dip below $50,000 continues to lose steam. Since reaching an all-time high of $73,000 in March, Bitcoin has been stuck in a downtrend, consistently making lower and lows.","Bitcoin's price fell below $59,000 during Thursday's U.S. trading session. Bitcoin has been stuck in a downtrend since reaching an all-time high of $73,000 in March. The day's most significant losses were seen in artificial intelligence-focused cryptocurrencies, which tumbled following a sharp decline in Nvidia's stock."
2024-08-30,"According to CoinDesk: Bitcoin's price dipped below $59,000 on Friday, marking a weekly loss of over 3.5%, as demand for the cryptocurrency wanes and exchange-traded funds (ETFs) see continued net outflows. The decline comes amid signs of reduced institutional interest, with U.S.-listed BTC ETFs recording $71 million in net outflows on Thursday, marking the third consecutive day of withdrawals, according to data from SoSoValue.The largest withdrawals were seen in Fidelity’s FBTC, which lost $31 million, and Grayscale’s GBTC, which saw outflows of $22 million. Notably, BlackRock’s iShares Bitcoin Trust (IBIT), the world’s largest bitcoin fund by assets under management, recorded its second-ever outflow, totaling $13 million. This shift indicates a move away from bitcoin by professional funds.Despite the overall decline, there are signs of increased interest from U.S. retail investors. On-chain analytics firm CryptoQuant reported an uptick in bitcoin price premiums on Coinbase, reaching the highest level since July. Additionally, bitcoin inflows from international exchanges to Coinbase have increased, suggesting higher demand from U.S. investors—a condition historically associated with price gains. Traders are bracing for increased volatility in the coming weeks, particularly after Labor Day, as economic reports and political developments are expected to influence market movements. The past week has seen bitcoin trading largely sideways, despite positive signals such as potential rate cuts and endorsements from political figures like Donald Trump.""Crypto had an uneventful week as BTC and ETH hovered around +/- 1.5% compared to last week's levels. ETF inflows remain subdued,"" Augustine Fan, head of insights at SOFA, noted in a weekly client update. Fan anticipates that market activity will pick up following the release of the U.S. non-farm payroll report and other key economic indicators.QCP Capital, a Singapore-based trading firm, echoed this sentiment, predicting choppy price action in the short term. ""Risk reversals until October are still skewed towards puts in both BTC and ETH, indicating that the market remains cautious about the downside,"" QCP said in a Telegram broadcast.The Federal Reserve's anticipated pivot towards lower borrowing costs next month has historically bolstered bullish sentiment, as cheaper access to capital often drives growth in riskier assets. However, in the absence of immediate catalysts, prices are expected to remain within a tight range as September approaches.The current market environment reflects a cautious outlook, with traders positioning themselves for potential rate cuts by the Fed. As the cryptocurrency market enters a traditionally volatile period, all eyes will be on how these dynamics play out in the weeks ahead.","Bitcoin's price dropped below $59,000 on Friday, marking a weekly loss of over 3.5%. BlackRock's iShares Bitcoin Trust (IBIT), the world's largest bitcoin fund by assets under management, recorded its second-ever outflow of $13 million on Thursday. There are signs of increased interest from U.S. retail investors. The current market environment"
2024-08-30,"According to Foresight News, CryptoQuant analyst Woominkyu has released a new analysis report highlighting a close correlation between Bitcoin's hash price and its market price. The current low hash price may suggest that Bitcoin's price is nearing its bottom. Woominkyu explains that the hash price reflects miners' profitability. He illustrates through historical data that when the hash price drops to lower levels, it often coincides with periods when Bitcoin's price is at or near its lowest point. This historical pattern indicates that the troughs in hash price frequently align with Bitcoin's price bottoms.","The current low hash price may suggest Bitcoin's price is nearing its bottom. The hash price reflects miners' profitability. The troughs in hash price frequently align with Bitcoin's prices bottoms. Woominkyu explains through historical data that when the hash price drops to lower levels, it often coincides with periods when Bitcoin is at or near its lowest point."
2024-08-30,"According to the Blockbeats: Today, Bitcoin options valued at a staggering $3.66 billion are set to expire, with a critical ""pain point"" at $61,000, according to data released by Adam, a researcher at Greeks.live. The options delivery data indicates that 62,000 BTC options are about to expire, with a Put Call Ratio of 0.59. The maximum pain point, which refers to the price level at which the highest number of options contracts expire worthless, stands at $61,000.In addition to Bitcoin, 530,000 ETH options are also nearing expiration, carrying a nominal value of $1.34 billion. The Put Call Ratio for ETH options is at 0.49, with a maximum pain point of $2,800.Today's expiration marks the monthly delivery for these options, and the data reveals notable market dynamics. Ethereum has shown relative weakness this month, with its maximum pain point over 10% different from the current delivery price. The medium- and long-term implied volatility (IV) has increased, while the medium- and short-term IV has decreased, suggesting limited room for further decline in overall IV.Historically, September tends to be a quieter month for cryptocurrency markets, often moving from weakness to strength as the month progresses. However, the fourth quarter is traditionally a stronger period for Bitcoin, and recent market activity shows that many large investors, or ""whales,"" are positioning themselves for potential gains in the October market.As the expiration of these substantial options contracts approaches, market participants will be closely watching to see how prices react, especially given the significant amounts at stake. The outcome could set the tone for the remainder of the year, with traders hoping for a robust market in the final months of 2024.","Today, Bitcoin options worth $3.66 billion are set to expire. The maximum price level at which the highest number of options contracts expire worthless is $61,000. 530,000 ETH options are also nearing expiration, carrying a nominal value of $1.34 billion. The Put Call Ratio for ETH options is at 0.49, with a maximum pain point of $"
2024-08-30,"According to BlockBeats, on August 30, Greeks.live researcher Adam shared data on social media regarding today's options expiration. A total of 62,000 BTC options are set to expire, with a Put Call Ratio of 0.59 and a maximum pain point of $61,000, amounting to a nominal value of $3.66 billion. Additionally, 530,000 ETH options are due to expire, with a Put Call Ratio of 0.49 and a maximum pain point of $2,800, representing a nominal value of $1.34 billion. Today marks the monthly expiration, and the options data clearly indicates a weakness in ETH this month, with the maximum pain point and expiration price differing by more than 10%. Mid-to-long-term implied volatility (IV) has increased, while short-to-medium-term IV has decreased, suggesting limited overall decline in IV. Historical trading data shows that September is typically a transitional month from weakness to strength, with the fourth quarter generally being a robust period for BTC. Recently, several large investors have begun positioning for October, hoping for favorable market conditions in the final four months of the year.","Today marks the monthly expiration of 62,000 BTC options with a maximum pain point of $61,000, amounting to a nominal value of $3.66 billion. 530,000 ETH options are due to expire, with a Put Call Ratio of 0.49 and a maximum price of $2,800. The maximum price and expiration price differ by more than 10%."
2024-08-30,"According to Cointelegraph, BlackRock’s Bitcoin exchange-traded fund (ETF) has experienced its second-ever outflow day since its launch in January. The iShares Bitcoin Trust ETF (IBIT) recorded a $13.5 million net outflow on August 29, following a previous outflow of $36.9 million on May 1. This earlier outflow was part of a record joint outflow day for Bitcoin ETFs, totaling $563.7 million, according to Farside Investors data. On August 29, the 11 United States-based Bitcoin ETFs collectively saw net outflows amounting to $71.8 million. BlackRock’s fund ranked third in outflows for the day, behind the Fidelity Wise Origin Bitcoin Fund (FBTC) with $31.1 million and the Grayscale Bitcoin Trust (GBTC) with $22.7 million. The outflow for IBIT came shortly after it recorded a significant net inflow of $224.1 million on August 26, its largest since July 22, when it saw $526.7 million in inflows. Cathie Wood’s ARK 21Shares Bitcoin ETF was the only fund to see net inflows on August 29, with $5.3 million. The recent Bitcoin ETF outflows coincide with a broader decline in Bitcoin’s price, which has dropped approximately 3.43% over the past week to trade at $58,751, according to CoinMarketCap. Meanwhile, US-based spot Ether (ETH) ETFs also experienced minor joint outflows of $1.7 million on August 29, with many funds seeing zero flows. Seven out of the nine Ether ETFs recorded no flows on that day. The Grayscale Ethereum Mini Trust (ETH) was the only ETF to register a net inflow of $3.6 million, which was insufficient to offset the $5.3 million in net outflows from its higher-fee counterpart, the Grayscale Ethereum Trust (ETHE). Since its launch in July, the Grayscale Ethereum Trust has seen net outflows nearly every day, accumulating $2.56 billion in total outflows. The price of ETH has also been on a downward trend, falling 5.64% over the past week to $2,517.06, according to CoinMarketCap.","BlackRock's Bitcoin exchange-traded fund (ETF) has experienced its second-ever outflow day since its launch in January. The 11 US-based Bitcoin ETFs collectively saw net outflows amounting to $71.8 million on August 29. Bitcoin's price has dropped 3.43% over the past week to trade at $58,751."
