Date,Description,Short Description
2024-09-12,"According to Cointelegraph, the TIME Magazine reporter who conducted one of the first foreign correspondent interviews with El Salvador President Nayib Bukele in three years has suggested that his push for Bitcoin as legal tender was more about image than substance. In an interview with Crooked Media’s Pod Save the World released on Sept. 11, Vera Bergengruen reported that Bukele’s advisers referred to Bitcoin (BTC) adoption in El Salvador as a “great rebranding” and “complete PR [public relations] move.” Bukele briefly led his family’s PR firm before moving into politics, becoming the Mayor of Nuevo Cuscatlán, Mayor of San Salvador, and president of El Salvador. “I think the most important thing [...] is his past as a publicist,” said Bergengruen, referring to Bukele. “It’s important to understand from Bitcoin to the war on the gangs, everything he does he’s kind of image first, results later oriented.” She added that Bitcoin was never really meant to be adopted to significantly change Salvadorans’ economic situation. Many in the crypto industry began paying attention to El Salvador and Bukele starting in 2021 after the president announced plans to recognize BTC as a legal tender. According to Bergengruen, the announcement was the first for the industry and the public in El Salvador, resulting in Bukele’s team having to “backtrack” and promote potential benefits of Bitcoin, like foreign remittances. “It was chaos from the start, but they needed to kind of at least pretend that it was really going to help El Salvador,” said Bergengruen. “It was very obvious that it was kind of for tourists, for foreigners, for [Bukele] to have something to talk about that changes the narrative. If that was the goal, they have been successful.” Bukele initially pushed for creating a volcano-powered “Bitcoin City” in the country, but the program was not completed more than three years later. He regularly posts on social media about using El Salvador’s funds to purchase BTC. According to Bergengruen’s interview, the president reported having roughly $400 million in the country’s “public wallet alone.” Bukele will serve as El Salvador’s president in his current term until 2029.",Time Magazine reporter Vera Bergengruen believes El Salvador's President Nayib Bukele's push for Bitcoin as legal tender was more about image than substance. She claims that Bitcoin was never meant to significantly change Salvadorans’ economic situation. The president will serve as El Salvador’s president until 2029.
2024-09-12,"On Sep 12, 2024, 18:53 PM(UTC). According to Binance Market Data, Bitcoin has dropped below 58,000 USDT and is now trading at 57,972 USDT, with a narrowed narrowed 0.87% increase in 24 hours.","Bitcoin has dropped below 58,000 USDT and is now trading at 57,972 USDT with a narrowed narrowed 0.87% increase in 24 hours. Bitcoin is trading at 18:53 PM(UTC) on Sep 12, 2024, 18."
2024-09-12,"According to Odaily, data from mempool.space indicates that transaction fees on the Fractal Bitcoin mainnet are steadily increasing. Several blocks have seen fees surpassing 2400 Sat/byte, with the current network fees reaching 2291 Sat/byte.","According to data from mempool.space, transaction fees on the Fractal Bitcoin mainnet are steadily increasing. Several blocks have seen fees surpassing 2400 Sat/byte. The current network fees are 2291 Sat-byte per block, according to the data from Odaily."
2024-09-12,"According to BlockBeats, on September 12, Arkham monitoring revealed that Grayscale addresses transferred 763.785 BTC, valued at approximately $44.05 million, to an unmarked address 26 minutes prior. Additionally, Grayscale Bitcoin Mini Trust transferred 700 BTC, worth around $40.37 million, to an unmarked address 26 minutes earlier.",Grayscale addresses transferred 763.785 BTC worth $44.05 million to an unmarked address 26 minutes earlier. Grayscale Bitcoin Mini Trust transferred 700 BTC worth around $40.37 million to a different address. BlockBeats monitored the transactions on September 12.
2024-09-12,"According to BlockBeats, on September 12, QCP Capital released a report highlighting that the recently announced U.S. Consumer Price Index (CPI) data met expectations, with the core CPI rising slightly month-over-month to 0.3%, surpassing the forecasted 0.2%. This development has increased the likelihood of a 25 basis point rate cut by the Federal Reserve to 85%, marking the highest probability in a month. In the cryptocurrency market, Bitcoin (BTC) rebounded from its intraday low, climbing back above $57,000, indicating strong demand and growing bullish sentiment. This optimism is reflected in options activity, with a growing number of investors purchasing call options expiring between October and December. This week, BTC volatility decreased by 12 points due to the impact of the CPI data release and the presidential debate. With no significant macroeconomic events on the horizon, it is anticipated that volatility will continue to decline ahead of next week's Federal Reserve meeting. Given the upcoming rate cut and the U.S. presidential election, which are significant economic events, the market is building momentum.","The recently announced U.S. Consumer Price Index (CPI) data met expectations and the core CPI rose slightly month-over-month to 0.3%, surpassing the forecasted 0.2%. This development has increased the likelihood of a 25 basis point rate cut by the Federal Reserve to 85%. Bitcoin has rebounded from its intraday low, climbing back above"
2024-09-12,"According to CoinDesk, RootstockCollective has been introduced as the first decentralized autonomous organization (DAO) on Bitcoin layer-2 Rootstock. This new DAO will enable holders of the Rootstock token RIF to earn voting rights by staking their tokens. The launch signifies a continuation of concepts typically associated with Ethereum making their way to Bitcoin, the world's oldest blockchain. DAOs are blockchain-based organizations where decisions are made by token holders rather than a central authority. While DAOs are prevalent on networks like Ethereum and Solana, they have been largely absent from Bitcoin due to its programmability constraints. Rootstock, a layer-2 network, aims to enhance Bitcoin's utility and is compatible with Ethereum's EVM programming standard for smart contracts. This compatibility allows applications originally built on Ethereum or related chains to be easily transferred to Rootstock. The trend of building on Bitcoin gained traction in early 2023 with the Ordinals protocol, which introduced a Bitcoin version of non-fungible tokens (NFTs). This trend has continued with the introduction of memecoins and other fungible tokens on the Runes protocol, and the BitVM computing paradigm, which facilitates smart contracts on Bitcoin. The RootstockCollective DAO aims to encourage builders and users of Rootstock by allowing RIF token holders to stake their tokens and earn voting rights. Staking involves users locking away their tokens to participate in the blockchain's verification process and receiving additional tokens as a reward.",RootstockCollective has been introduced as the first decentralized autonomous organization (DAO) on Bitcoin layer-2 Rootstock. The new DAO allows Rootstock token holders to earn voting rights by staking their tokens. The DAO is compatible with the EVM programming standard for smart contracts.
2024-09-12,"According to Odaily, Anchorage Digital has announced that it will offer custody services for 21Shares' spot Bitcoin and Ethereum ETFs. The company will implement biometric authentication for issuers and participants involved in the crypto ETFs to enhance security.",Anchorage Digital has announced it will offer custody services for 21Shares' spot Bitcoin and Ethereum ETFs. The company will implement biometric authentication for issuers and participants involved in the crypto ETFs to enhance security. The service will be available for Bitcoin and Etherium.
2024-09-12,"On Sep 12, 2024, 10:31 AM(UTC). According to Binance Market Data, Bitcoin has dropped below 58,000 USDT and is now trading at 57,996 USDT, with a narrowed narrowed 2.48% increase in 24 hours.","Bitcoin has dropped below 58,000 USDT and is now trading at 57,996 USDT, with a narrowed narrowed 2.48% increase in 24 hours. Bitcoin is trading at 10:31 AM(UTC) on Sep 12, 2024, 10:30 AM(GMT)."
2024-09-12,"According to BlockBeats, on September 12, UniSat officially announced the launch of its iOS application on the App Store. The new app aims to provide seamless Bitcoin management along with several advanced features for users. The main features of the UniSat iOS version include support for the Fractal Bitcoin mainnet, enabling convenient and instant inscription and trading of BRC20 and Runes inscriptions upon activation. Additionally, the app allows for smooth switching between accounts and wallets, and offers one-click transfer functions for Bitcoin, inscriptions, and Runes.",UniSat has launched its iOS app on the App Store on September 12th. The new app aims to provide seamless Bitcoin management along with several advanced features for users. The main features of the UniSat iOS version include support for the Fractal Bitcoin mainnet and instant inscription and trading of BRC20 and Runes inscriptions upon activation.
2024-09-12,"According to Foresight News, monitoring by Spot On Chain reveals that the government of El Salvador has been purchasing one Bitcoin daily for 665 consecutive days, unaffected by market fluctuations. Currently, the government holds 5,871 Bitcoins, valued at approximately $342 million. Of these, 3,046 Bitcoins have been publicly disclosed, with an average purchase price of $43,888 per Bitcoin.","The government of El Salvador has been buying 5,871 Bitcoins daily for 665 consecutive days at an average price of $43,888 per Bitcoin. The government holds about $342 million worth of Bitcoins, valued at approximately $1.5 million each."
2024-09-12,"This week, our desk noticed that BTC market volatility started to pick up, with multiple key data releases on the US labour market and CPI before next week’s FOMC meeting. BTC price was closely tracking the US equities performance, while some altcoins had a more independent journey.Sui ($SUI) is a unique Layer 1 blockchain and smart contract platform that seeks to enhance digital asset ownership by making it fast, private, and accessible to everyone. The recently launched Grayscale Sui Trust, by the digital asset manager Grayscale, is available to accredited investors for SUI exposure. The bullish news helped SUI achieve a 15.3% gain in one week while BTC had a 0.8% loss during the same time.Book of Meme ($BOME) also saw strong trade demand on Convert last week. This meme coin saw a 73.4% volume increase on Convert and a 4.1% gain last week, outperforming many other meme coins with similar market capitalization.The layer-1 blockchain Cardano ($ADA) was introduced in 2017 by Charles Hoskinson, a co-founder of Ethereum. Its eagerly awaited ""Chang"" update was released on September 1st, completing the ecosystem's long-term shift to decentralized governance. Holders of ADA tokens will be able to influence Cardano's future by choosing governance representatives and approving development ideas thanks to this hard fork update. Last week, ADA had a 7.2% gain due to the bullish sentiment after the upgrade.Overall MarketThe above chart shows the BTC price movement in the 8-hour chart.The BTC price has been trading in this blue downward trend for nearly six months, and it has experienced a significant correction, with a 34% drop from the all-time high of $73,777 to $49,000, a market low caused by the carry trade unwind on August 5. As previously discussed, the $50k/$52k range served as a strong support zone, with the $57k level providing local support. BTC prices tested this again in the $50k/52k range last Friday following the disappointing nonfarm payroll data in the United States, raising market concerns about the US economy and the need for a 50 basis point rate cut by the Fed on September 18. Historically, when the Fed lowers interest rates in poor economic conditions, it usually results in a recession within 12 to 18 months.  And we expressed concern that the Fed's 50 basis point rate cut would trigger another round of risk asset sell-offs, pushing the BTC price below the strong support range of 50k/52k. If that scenario unfolds, the current bull cycle will effectively end and become the shortest in BTC history, aside from the 2013 cycle.This week's CPI data suggests that inflation in the United States is moving in the Fed's favour, and the market is now leaning toward a 25 basis point rate cut by the Fed on September 18. The reduced concern about a potential recession in the United States encourages risk-taking. Following the initial reaction to the CPI data, US stocks rallied and recovered all of their losses, closing higher. BTC tracked US equities closely, falling below $55.7k before rising above $57k before the session ended.The FOMC meeting will take place next week, and our desk anticipates some market volatility around the time when Fed Chair Powell delivers his speech after the meeting.Options MarketThe above chart is the 25-delta skewness on BTC options in the last two weeks.A 25-delta skew on options refers to the premium difference between a 25-delta call and a 25-delta put with the same expiry. The negative skew indicates that options traders would prefer to pay a higher premium on puts for downside protection than on calls for upside rewards. It provides a proxy measure for market sentiments by tracking the 25-delta skew across different expirations.As shown in the chart above, front-end BTC options (with a 7-day expiry) have been negative for the last two weeks, with the negative skew further lowering last Friday when BTC was sold below $52.7k. The chart also showed that market sentiment shifted to neutral over the weekend as the Bitcoin price recovered.The skew in medium- to long-term options suggested that options traders were not as bearish as indicated by the front-end options. In the last two weeks, the 60-day, 90-day, and 180-day expired options have all had above-zero skews, while the longer-dated options have maintained steady skews above 0. With the risk backdrop of reduced concern on the US recession and a Fed rate cut on the horizon, risk appetite is encouraged. We anticipate that the skew on BTC options across all durations will rise, indicating some bullish sentiment before/after the FOMC meeting.Macro at a glance Last Thursday (24-09-05)According to ADP nonfarm employment data, the US private market added only 99k new jobs in August, far below analysts' expectations of 144k. The weak ADP data raised market concerns about the US economy's conditions, increasing the likelihood of a 50 basis point rate cut by the Fed in September.Last week, the number of initial jobless claims in the United States was 227k, which was lower than the estimated 231k.The S&P Global Services PMI was 55.7 in August, up from the forecasted 55.2.Last Friday (24-09-06)In the United States, nonfarm payrolls (NFP) increased by 142,000 in August, less than 160,000 market expectations. This followed an increase of 89,000 in July, revised from 114,000. The USD index traded volatilely in the Friday session, while US equities fell as concerns about the US economy outweighed risk appetite.The US unemployment rate fell back to 4.2% in August, after hitting 4.3% in July.The unemployment rate in Canada increased to 6.6% in August, exceeding the forecasted 6.5% and July's 6.4%.BTC price experienced a significant sell-off in the Friday US session and found support at 52.5k following an 8% drop.On Monday (24-09-09)The unemployment rate in the UK fell to 4.1% in July from 4.2% in June, meeting economists' expectations.The German CPI fell by 0.1% monthly in August, compared to a 0.3% increase in July. The annualized CPI change was 1.9%, which is lower than the 2.3% increase in July.On Wednesday (24-09-11)The US CPI increased by 0.2% month on month in August, matching the pace seen in July. August saw annualized CPI growth of 2.5%, down from 2.9% in July. However, the monthly core CPI growth rate reaches 0.3%, exceeding the estimated 0.2% and July's 0.2%. The stubborn shelter cost served as the primary driver of the unexpectedly higher core CPI growth.The CPI data released on Wednesday solidified the Federal Reserve's decision to cut interest rates by 25 basis points next week, with an 86% probability. US equities initially lost some ground after the CPI data was released. The market then turned bullish as the Fed's chances of cutting interest rates by 25 basis points increased, and risk assets were bid up. The S&P 500 index finished up 1.07%, while the Nasdaq index rose 2.15%. As a first reaction, the BTC price fell below $55.7k before regaining the $57,000 level by market close.Convert Portal Volume ChangeThe above table shows the volume change on our Convert Portal by zone. Market volatility began to rise in early September, and the BTC price closely tracked US equities. Last Friday after the weak job data in the US, the BTC price fell below $52.7k amid rising concerns about the US economy. The sentiment improved over the weekend, and BTC returned to above $57k on Wednesday.Last week, the Megadrop Zone saw a volume increase of 59.8%. The primary reason for the volume increase was the high demand for BounceBit ($BB).The volume of the Storage zone increased by 14.0% during the same time period. The BitTorrent ($BTTC) demand surge was the primary driver of the volume increase in the Storage zone.In addition, the NFT Zone's volume increased by 4.3%. The change was primarily driven by Mines of Dalarnia ($DAR).Why trade OTC?  Binance offers our clients various ways to access OTC trading, including chat communication channels and the Binance OTC platform (https://www.binance.com/en/otc) for manual price quotations, Algo Orders, or automated price quotations via Binance Convert and Block Trade platform (https://www.binance.com/en/convert) and the Binance Convert OTC API. Email: trading@binance.com for more information.Join our Telegram (https://t.me/BinanceOTC) to stay up to date with the markets!","This week, the US labour market and CPI data released before next week’s FOMC meeting. Some altcoins had a more independent journey. Sui is a new layer 1 blockchain and smart contract platform. SUI achieved a 15.3% gain in one week. Book of Meme ($BOME) also saw a 73.4% volume increase on Convert"
2024-09-12,"According to Foresight News, Bitcoin staking platform Solv has integrated Chainlink's Cross-Chain Interoperability Protocol (CCIP) to launch the industry's largest cross-chain Bitcoin staking solution. This new solution supports SolvBTC and its Liquid Staking Tokens (LST) assets, including SolvBTC.BBN and SolvBTC.ENA, enabling cross-chain interoperability across Ethereum, BNB Chain, Arbitrum, and Avalanche. The platform plans to expand to additional networks in the future. Currently, the total amount of SolvBTC and its LST products exceeds 20,000 Bitcoins, with over 10,000 Bitcoin assets achieving cross-chain functionality through Solv. This development marks a significant milestone in the evolution of cross-chain Bitcoin staking, providing users with enhanced flexibility and broader network support.","Solv has integrated Chainlink's Cross-Chain Interoperability Protocol (CCIP) to launch the industry's largest cross-chain Bitcoin staking solution. SolvBTC and its Liquid Staking Tokens (LST) have over 10,000 Bitcoin assets that can be staked on different networks."
2024-09-12,"According to CoinDesk, Bitcoin rose above $58,000 during Asian trading hours on Thursday, driven by a rally in U.S. technology stocks and gains in Asian equity markets. Despite this increase, U.S. spot bitcoin ETFs experienced outflows, with Ark Invest’s ARKB seeing a notable $54 million outflow, contributing to a total loss of $43 million after a two-day inflow streak.U.S. inflation data for August supported expectations for a Federal Reserve rate cut in the coming weeks, as core inflation rose faster than anticipated to more than 0.3%. This economic backdrop saw chipmaker Nvidia (NVDA) end the day up 8.2%, while major stocks like Microsoft (MSFT), Google (GOOGL), and Apple (AAPL) saw gains as high as 2.13%. These gains extended to Asian markets on Thursday, with stock indices in Japan, South Korea, and Taiwan surging. Japan’s Nikkei 225 index broke out of a seven-day losing streak as the yen slightly retreated after hitting a record high against the U.S. dollar on Tuesday.Meanwhile, layer-1 blockchain Sui (SUI) outperformed the market, rising over 16% according to CoinDesk Indices data, compared to a 1.67% rise in the broader CoinDesk 20 (CD20) index. SUI's performance is likely influenced by Grayscale’s recent announcement about opening the Grayscale Sui Trust. According to Grayscale, the NAV per share of the Trust is $13.50, with each share containing 14.95 SUI tokens, valuing each Sui token in the trust at 90 cents. Given Sui’s current market value of just over $1, the market appears to be anticipating a Grayscale discount.Elsewhere, AI tokens posted modest gains amid reports that OpenAI is planning to raise $6.5 billion at a valuation of $150 billion. NEAR Protocol’s NEAR token increased by 6%, while the Artificial Superintelligence Alliance’s FET token rose by 9%, trading above $1.40.","Bitcoin rose above $58,000 during Asian trading hours on Thursday, driven by a rally in technology stocks and gains in Asian equity markets. U.S. spot bitcoin ETFs experienced outflows, with Ark Invest’s ARKB having a total loss of $43 million."
2024-09-12,"According to BlockBeats, on September 12, renowned cryptocurrency analyst Willy Woo shared his insights on social media regarding the current state of Bitcoin. Woo highlighted several key points about Bitcoin's short-term, mid-term, and macro trends.In the short term, Woo indicated that the timing signals suggest a bullish fluctuation over the next 1-3 weeks. This optimistic outlook is based on recent market activities and trends observed in the cryptocurrency space.For the mid-term, Woo noted that since the halving event in April, the supply-demand dynamics have been bearish. However, he mentioned that the past four weeks might have started to show signs of a reversal, although this has not yet been confirmed. Woo emphasized that more time is needed for Bitcoin to break its historical highs.On a macro level, Woo pointed out that risk signals have validated lower lows, indicating that Bitcoin is not in a bear market. Instead, it is in a reaccumulation phase, waiting for the right conditions to emerge. This phase suggests that investors are gradually building up their positions, anticipating future growth.","Willy Woo shared his insights on social media regarding Bitcoin's short-term, mid-term and macro trends. In the short term, the timing signals suggest a bullish fluctuation over the next 1-3 weeks. Since the halving event in April, the supply-demand dynamics have been bearish. The past 4 weeks might have started to show signs of a reversal."
2024-09-12,"According to BlockBeats, on September 12, CryptoQuant analyst Tarek On-Chain shared insights on social media regarding the current trends in Bitcoin reserves on exchanges. He noted that Bitcoin reserves on exchanges are significantly decreasing, a trend that typically signals a price increase. The reduction in Bitcoin reserves on exchanges implies a decrease in selling pressure as investors move their Bitcoin to cold wallets, reducing the available supply in the market. Historically, such transfers have often been accompanied by price peaks, suggesting a similar situation might be unfolding now.At the same time, the reserves of stablecoins on exchanges are increasing, indicating that investors are preparing to enter the market. Stablecoins represent capital that can be deployed at any moment, and their increasing reserves suggest that traders are waiting for the right opportunity to enter the market. This growth indicates a strong buying intention within the market.Decreasing Bitcoin reserves and increasing stablecoin reserves sets the stage for a potential price surge. With the supply of Bitcoin decreasing and purchasing power increasing, the market is poised for an upward trend. Historically, such supply-demand imbalances have often led to significant price increases.The decrease in Bitcoin reserves coupled with the increase in stablecoin reserves suggests a bullish outlook for Bitcoin. As market supply tightens and purchasing power accumulates, we may see a price breakout in the coming weeks. Investors should remain vigilant and watch for potential market upswings.",The current trends in Bitcoin reserves on exchanges are decreasing and stablecoin reserves are increasing. Stablecoins represent capital that can be deployed at any moment and their increasing reserves suggest that traders are waiting for the right opportunity to enter the market. The supply-demand imbalances have often led to significant price increases.
2024-09-12,"According to BlockBeats, as of September 11, the Monochrome Bitcoin ETF (IBTC) in Australia has reached a holding of 136 BTC. This information was confirmed through official sources on September 12.",The Monochrome Bitcoin ETF (IBTC) in Australia has reached a holding of 136 BTC as of September 11th. This information was confirmed through official sources on September 12th. BlockBeats has confirmed this information to Blockbeats' sources. The information has been confirmed by official sources.
